{
  "id": "signal-delivery-identity-is-distinct",
  "domain": "signal",
  "kind": "positive",
  "title": "投递身份与业务信号身份分离，重投递可被区分且可判定幂等",
  "semantics": "信号具备投递身份：每次投递自带投递标识与尝试序号，业务信号标识只回答「这是哪条信号」。这让「同一条信号被重投三次」与「三条不同信号」在内核侧可区分，也让重复投递可判定幂等。缺失投递身份或尝试序号为零的投递被结构化拒绝。",
  "given": [
    "一个正在运行的操作",
    "宿主观察到一条外部信号"
  ],
  "when": [
    "宿主用同一投递身份重复投递，并另用新的投递身份投递同一条业务信号"
  ],
  "then": [
    "投递身份与业务信号身份是两个独立事实",
    "同一投递身份的重复投递可判定为重放，不产生第二次处置",
    "新的投递身份即使承载同一条业务信号，也记为一次新的投递尝试",
    "缺失投递身份或尝试序号为零的投递被结构化拒绝"
  ],
  "evidence": {
    "sources": [
      "spec §7.7「External event」",
      "spec §14.1「signal delivery」与 §3.4 能力对照矩阵",
      "crates/deepstrike-core/src/runtime/kernel/tests.rs::signal_redelivery_attempts_are_correlated_and_distinct",
      "crates/deepstrike-core/src/runtime/kernel/tests.rs::signal_delivery_rejects_missing_identity_or_zero_attempt"
    ]
  },
  "target": "§7.7"
}
