{
  "id": "workflow-no-stack-and-root-kind-immutable",
  "domain": "workflow",
  "kind": "positive",
  "title": "代理发起的工作流不形成栈：焦点转移是封闭的两条边，深度至多一层",
  "semantics": "一个操作只有一个根生命周期。代理通过内核能力请求发起工作流时，根类别仍是代理，只有执行焦点变化，且转移规则是封闭的：代理根的初始焦点是代理轮次；唯一的两条合法转移是「工作流启动动作提交时切到工作流控制器（记录父任务）」与「该工作流以任意方式收束时切回原代理轮次」。深度至多一层——处于工作流控制器焦点期间再请求启动工作流是权限类结构化拒绝。工作流为根时焦点恒定，图内节点的代理执行是子任务尝试，不改变根焦点。焦点只在已提交的转移里改变，不存在任何可由宿主直接设置焦点的输入。",
  "given": [
    "一个以代理为根、正在运行的操作",
    "模型在一次工具调用中请求启动一个工作流",
    "另有一个以工作流为根、正在运行的操作作为对照"
  ],
  "when": [
    "内核放行该请求并建立依赖图",
    "在工作流控制器焦点期内，模型再次请求启动一个工作流",
    "宿主试图直接设置执行焦点"
  ],
  "then": [
    "根类别保持为代理，不因该请求改变",
    "焦点在工作流启动动作提交的同一次转移里从代理轮次切到工作流控制器，并记录父任务",
    "该工作流无论成功、失败还是被取消，收束提交时焦点都切回原来的代理轮次",
    "焦点期内再次请求启动工作流被权限类结构化拒绝，且不产生任何派生动作",
    "焦点深度至多一层，不存在工作流栈",
    "以工作流为根时焦点全生命周期不变，图内节点的代理执行不改变根焦点",
    "不存在任何可由宿主直接设置焦点的输入，焦点只随已提交的转移改变"
  ],
  "evidence": {
    "sources": [
      "spec §7.4「焦点转移规则（封闭，GAP-1 裁决）」",
      "spec §10.2「Agent-authored workflow」规则与 §15.4「workflow 不形成 stack」",
      "canonical-kernel-abi-capability-inventory.md §8.1「未达标」：bootstrap 会把代理根变成工作流驱动",
      "crates/deepstrike-core/src/runtime/kernel/tests.rs::submit_workflow_input_bootstraps_a_dag_over_the_abi"
    ]
  },
  "target": "§7.4"
}
