{
  "id": "removed-session-log-payload-lookup",
  "domain": "removed",
  "kind": "negative",
  "title": "删除：通过业务会话日志扫描找回正文或重建状态的路径",
  "semantics": "业务日志是给人与运维看的投影，不是内核恢复的事实源，也不是正文的寻址方式。删除按目录与业务日志线性扫描回捞大结果的回退路径，以及把不透明引用当作文件路径直接读盘的旁路。正文可达性只由上下文虚拟机的句柄表决定，读取只按不透明引用执行；不透明引用不得被解释为文件路径。业务日志的修复工具可以保留为离线诊断手段，但不属于生产恢复契约。",
  "given": [
    "一个曾经产生外部正文的操作",
    "模型请求读取某个历史结果的完整正文"
  ],
  "when": [
    "宿主处理该读取请求"
  ],
  "then": [
    "不得扫描业务日志或目录来定位正文",
    "读取归约为一次按句柄的装载请求，并产生对应的外部动作",
    "不透明引用不得按文件路径解释或直接读盘",
    "业务日志只保留审计与展示职责"
  ],
  "evidence": {
    "sources": [
      "spec §9.2、§9.3 与 §7.10 规则 6–7、§25 第 14 条",
      "node/src/runtime/runner.ts:2043（resolveReadResult 目录扫描 + 业务日志回退）",
      "python/deepstrike/runtime/execution_plane.py:199（按 .spool/ 路径直接读盘）"
    ]
  },
  "target": "§9.3"
}
