{
  "id": "removed-self-declared-caller",
  "domain": "removed",
  "kind": "negative",
  "title": "删除：调用方自声明身份的全部旁路",
  "semantics": "任何让宿主自由填写「是谁发起的」的通道都删除，包括：可选的提交者标识字段（省略即不降权，等于提权）、宿主代模型发起的技能激活、以及 SDK 把内核工具从工具循环中剔除、伪造一段工具结果文本、再在另一次转移里代为提交并回填提交者的改写路径。自由形式的调用者请求从未进入生产契约，也不会落地。调用者只能由内核从待决因果或子任务尝试推导。",
  "given": [
    "一个正在运行的操作",
    "模型或子代理试图请求一项内核能力"
  ],
  "when": [
    "宿主在请求中自行填写调用者标识，或代替模型发起该请求"
  ],
  "then": [
    "自声明的调用者标识在契约里不存在",
    "宿主代发的能力请求被拒绝",
    "跨转移的宿主转发通道被删除",
    "调用者只能由内核从待决因果或子任务尝试推导",
    "省略身份不再等价于免降权"
  ],
  "evidence": {
    "sources": [
      "spec §14.3 caller 自声明旁路删除清单与 §2.1 第 14 条",
      "spec §22.10「保留任何 host 自由声明 caller 的形态」被否决",
      "canonical-kernel-abi-capability-inventory.md §8.2 五条旁路（crates/deepstrike-core/src/runtime/kernel/protocol.rs:744-745、node/src/runtime/runner.ts:2689-2696、:2743、:1716）"
    ]
  },
  "target": "§14.3"
}
